<?xml version="1.0" encoding="UTF-8" standalone="no"?>
<!DOCTYPE root SYSTEM "mtbase.dtd">
<root>
	<transicion>
		<movimiento>R</movimiento>
		<si>a</si>
		<qj>1</qj>
		<qi>0</qi>
		<sj>#</sj>
	</transicion>
	<transicion>
		<qi>1</qi>
		<si>a</si>
		<sj>#</sj>
		<qj>1</qj>
		<movimiento>R</movimiento>
	</transicion>
	<transicion>
		<qi>1</qi>
		<si>b</si>
		<movimiento>R</movimiento>
		<qj>1</qj>
		<sj>#</sj>
	</transicion>
	<transicion>
		<qi>1</qi>
		<si>c</si>
		<qj>2</qj>
		<sj>#</sj>
		<movimiento>R</movimiento>
	</transicion>
	<transicion>
		<qi>2</qi>
		<si>a</si>
		<qj>3</qj>
		<sj>#</sj>
		<movimiento>R</movimiento>
	</transicion>
	<transicion>
		<qi>3</qi>
		<si>a</si>
		<qj>3</qj>
		<sj>#</sj>
		<movimiento>R</movimiento>
	</transicion>
	<transicion>
		<qi>3</qi>
		<si>b</si>
		<qj>3</qj>
		<sj>#</sj>
		<movimiento>R</movimiento>
	</transicion>
	<transicion>
		<qi>0</qi>
		<si>b</si>
		<qj>4</qj>
		<sj>#</sj>
		<movimiento>R</movimiento>
	</transicion>
	<transicion>
		<qi>4</qi>
		<si>a</si>
		<qj>4</qj>
		<sj>#</sj>
		<movimiento>R</movimiento>
	</transicion>
	<transicion>
		<qi>4</qi>
		<si>b</si>
		<qj>4</qj>
		<sj>#</sj>
		<movimiento>R</movimiento>
	</transicion>
	<transicion>
		<qi>4</qi>
		<si>c</si>
		<qj>5</qj>
		<sj>#</sj>
		<movimiento>R</movimiento>
	</transicion>
	<transicion>
		<qi>5</qi>
		<si>b</si>
		<qj>6</qj>
		<sj>#</sj>
		<movimiento>R</movimiento>
	</transicion>
	<transicion>
		<qi>6</qi>
		<si>a</si>
		<qj>6</qj>
		<sj>#</sj>
		<movimiento>R</movimiento>
	</transicion>
	<transicion>
		<qi>6</qi>
		<si>b</si>
		<qj>6</qj>
		<sj>#</sj>
		<movimiento>R</movimiento>
	</transicion>
</root>
