<?xml version="1.0" encoding="UTF-8" standalone="no"?>
<!DOCTYPE root SYSTEM "mtbase.dtd">
<root>
	<transicion>
		<si>0</si>
		<qj>0</qj>
		<sj>0</sj>
		<movimiento>R</movimiento>
	</transicion>
	<transicion>
		<qi>0</qi>
		<si>1</si>
		<qj>1</qj>
		<movimiento>R</movimiento>
	</transicion>
</root>
