<?xml version="1.0" encoding="UTF-8" standalone="no"?>
<!DOCTYPE root SYSTEM "mtbase.dtd">
<root>
	<transicion>
		<qi>0</qi>
		<si>0</si>
		<qj>1</qj>
		<sj>X</sj>
		<movimiento>R</movimiento>
	</transicion>
	<transicion>
		<qi>1</qi>
		<si>0</si>
		<qj>1</qj>
		<sj>0</sj>
		<movimiento>R</movimiento>
	</transicion>
	<transicion>
		<qi>1</qi>
		<si>Y</si>
		<qj>1</qj>
		<sj>Y</sj>
		<movimiento>R</movimiento>
	</transicion>
	<transicion>
		<qi>1</qi>
		<si>1</si>
		<qj>2</qj>
		<sj>Y</sj>
		<movimiento>R</movimiento>
	</transicion>
	<transicion>
		<qi>2</qi>
		<si>X</si>
		<qj>0</qj>
		<sj>X</sj>
		<movimiento>R</movimiento>
	</transicion>
	<transicion>
		<qi>2</qi>
		<si>0</si>
		<qj>2</qj>
		<sj>0</sj>
		<movimiento>L</movimiento>
	</transicion>
	<transicion>
		<qi>2</qi>
		<si>#</si>
		<qj>3</qj>
		<sj>#</sj>
		<movimiento>L</movimiento>
	</transicion>
	<transicion>
		<qi>2</qi>
		<si>1</si>
		<qj>2</qj>
		<sj>1</sj>
		<movimiento>L</movimiento>
	</transicion>
	<transicion>
		<qi>2</qi>
		<si>Y</si>
		<qj>2</qj>
		<sj>Y</sj>
		<movimiento>L</movimiento>
	</transicion>
	<transicion>
		<qi>3</qi>
		<si>Y</si>
		<qj>3</qj>
		<sj>Y</sj>
		<movimiento>L</movimiento>
	</transicion>
	<transicion>
		<qi>3</qi>
		<si>X</si>
		<qj>4</qj>
		<sj>X</sj>
		<movimiento>L</movimiento>
	</transicion>
	<transicion>
		<qi>4</qi>
		<si>X</si>
		<qj>4</qj>
		<sj>X</sj>
		<movimiento>L</movimiento>
	</transicion>
	<transicion>
		<qi>4</qi>
		<si>#</si>
		<qj>5</qj>
		<sj>#</sj>
		<movimiento>R</movimiento>
	</transicion>
</root>